{
  "schema_version": 1,
  "record_id": "uos.discovery.synthetic.cedar-unlocked-v1",
  "architecture": "armv7",
  "hardware": {"board_family": "synthetic-cedar", "soc_family": "synthetic-r2", "revision_class": "1"},
  "boot": {"bootloader_state": "unlocked", "partition_model": "transactional"},
  "transport": {"protocol": "recovery"}
}
